{
  "commandName": "JmeCreateDeclarationV2Command",
  "definingSystem": "JME",
  "description": "Initiate the creation of a customs declaration.",
  "topic": "jme-messaging-create-declaration-v2",
  "scope": "public",
  "versions": [
    {
      "version": "1.0.0",
      "valueSchema": "JmeCreateDeclarationV2Command_v1.0.0.avdl",
      "compatibilityMode": "BACKWARD"
    },
    {
      "version": "1.1.0",
      "valueSchema": "JmeCreateDeclarationV2Command_v1.1.0.avdl",
      "compatibilityMode": "FULL"
    }
  ]
}
