{
  "commandName": "JmeCreateDeclarationCommand",
  "definingSystem": "JME",
  "description": "Initiate the creation of a customs declaration.",
  "topic": "jme-messaging-create-declaration",
  "scope": "public",
  "versions": [
    {
      "version": "1.0.0",
      "valueSchema": "JmeCreateDeclarationCommand_v1.0.0.avdl"
    },
    {
      "version": "1.1.0",
      "valueSchema": "JmeCreateDeclarationCommand_v1.1.0.avdl",
      "compatibilityMode": "BACKWARD"
    },
    {
      "version": "2.0.0",
      "valueSchema": "JmeCreateDeclarationCommand_v2.0.0.avdl",
      "compatibilityMode": "BACKWARD"
    }
  ]
}
